{
  "$schema": "https://json-schema.org/draft/2020-12/schema",
  "title": "Public portfolio input v1",
  "type": "object",
  "additionalProperties": false,
  "required": ["content_schema_version", "source_repository", "source_commit", "manifest_sha256", "project"],
  "properties": {
    "content_schema_version": {"const": 1},
    "source_repository": {"enum": ["OleksiiMamchurAlx/adaptive-ai-router-demo", "OleksiiMamchurAlx/graphics-installer-validation"]},
    "source_commit": {"type": "string", "pattern": "^[0-9a-f]{40}$"},
    "manifest_sha256": {"type": "string", "pattern": "^[0-9a-f]{64}$"},
    "project": {"type": "object", "description": "Exact approved project contract plus independently timestamped verification; enforced by validate_record and the pinned project policy"}
  }
}
